{
  "schema_version": "0.1.0",
  "plan_id": "synthetic-full-floor-plan-v1",
  "domain_id": "building-architecture",
  "plan_type": "architectural_floor_plan",
  "units": {
    "length": "mm",
    "angle": "deg"
  },
  "coordinate_system": {
    "datum": "synthetic-local",
    "origin": [
      0,
      0
    ],
    "azimuth": 0,
    "scale": {
      "horizontal": 1,
      "vertical": 1
    }
  },
  "provenance_ledger": {
    "axis-1": {
      "status": "specified",
      "source_id": "synthetic-floor-plan-v1",
      "confidence": 1.0
    },
    "axis-2": {
      "status": "specified",
      "source_id": "synthetic-floor-plan-v1",
      "confidence": 1.0
    },
    "axis-3": {
      "status": "specified",
      "source_id": "synthetic-floor-plan-v1",
      "confidence": 1.0
    },
    "axis-A": {
      "status": "specified",
      "source_id": "synthetic-floor-plan-v1",
      "confidence": 1.0
    },
    "axis-B": {
      "status": "specified",
      "source_id": "synthetic-floor-plan-v1",
      "confidence": 1.0
    },
    "bearing-lower": {
      "status": "specified",
      "source_id": "synthetic-floor-plan-v1",
      "confidence": 1.0
    },
    "bearing-upper": {
      "status": "specified",
      "source_id": "synthetic-floor-plan-v1",
      "confidence": 1.0
    },
    "bed": {
      "status": "specified",
      "source_id": "synthetic-floor-plan-v1",
      "confidence": 1.0
    },
    "bedroom": {
      "status": "specified",
      "source_id": "synthetic-floor-plan-v1",
      "confidence": 1.0
    },
    "bedroom-door": {
      "status": "specified",
      "source_id": "synthetic-floor-plan-v1",
      "confidence": 1.0
    },
    "bedroom-window": {
      "status": "specified",
      "source_id": "synthetic-floor-plan-v1",
      "confidence": 1.0
    },
    "bottom-left": {
      "status": "specified",
      "source_id": "synthetic-floor-plan-v1",
      "confidence": 1.0
    },
    "bottom-right": {
      "status": "specified",
      "source_id": "synthetic-floor-plan-v1",
      "confidence": 1.0
    },
    "column-1": {
      "status": "specified",
      "source_id": "synthetic-floor-plan-v1",
      "confidence": 1.0
    },
    "column-2": {
      "status": "specified",
      "source_id": "synthetic-floor-plan-v1",
      "confidence": 1.0
    },
    "column-3": {
      "status": "specified",
      "source_id": "synthetic-floor-plan-v1",
      "confidence": 1.0
    },
    "column-4": {
      "status": "specified",
      "source_id": "synthetic-floor-plan-v1",
      "confidence": 1.0
    },
    "column-5": {
      "status": "specified",
      "source_id": "synthetic-floor-plan-v1",
      "confidence": 1.0
    },
    "column-6": {
      "status": "specified",
      "source_id": "synthetic-floor-plan-v1",
      "confidence": 1.0
    },
    "entry": {
      "status": "specified",
      "source_id": "synthetic-floor-plan-v1",
      "confidence": 1.0
    },
    "internal-door": {
      "status": "specified",
      "source_id": "synthetic-floor-plan-v1",
      "confidence": 1.0
    },
    "kitchen": {
      "status": "specified",
      "source_id": "synthetic-floor-plan-v1",
      "confidence": 1.0
    },
    "kitchen-unit": {
      "status": "specified",
      "source_id": "synthetic-floor-plan-v1",
      "confidence": 1.0
    },
    "left": {
      "status": "specified",
      "source_id": "synthetic-floor-plan-v1",
      "confidence": 1.0
    },
    "living": {
      "status": "specified",
      "source_id": "synthetic-floor-plan-v1",
      "confidence": 1.0
    },
    "living-window": {
      "status": "specified",
      "source_id": "synthetic-floor-plan-v1",
      "confidence": 1.0
    },
    "overall-depth": {
      "status": "specified",
      "source_id": "synthetic-floor-plan-v1",
      "confidence": 1.0
    },
    "overall-width": {
      "status": "specified",
      "source_id": "synthetic-floor-plan-v1",
      "confidence": 1.0
    },
    "partition": {
      "status": "specified",
      "source_id": "synthetic-floor-plan-v1",
      "confidence": 1.0
    },
    "right-lower": {
      "status": "specified",
      "source_id": "synthetic-floor-plan-v1",
      "confidence": 1.0
    },
    "right-upper": {
      "status": "specified",
      "source_id": "synthetic-floor-plan-v1",
      "confidence": 1.0
    },
    "sofa": {
      "status": "specified",
      "source_id": "synthetic-floor-plan-v1",
      "confidence": 1.0
    },
    "top-left": {
      "status": "specified",
      "source_id": "synthetic-floor-plan-v1",
      "confidence": 1.0
    },
    "top-right": {
      "status": "specified",
      "source_id": "synthetic-floor-plan-v1",
      "confidence": 1.0
    }
  },
  "assumptions": [],
  "source_inventory": {
    "source_id": "synthetic-floor-plan-v1",
    "source_sha256": "6879f90c30a76b6abfcf0d6450b9d76a2429006a97609aae9f1b0916a0f508cf",
    "source_type": "specified",
    "review_passes": [],
    "items": [
      {
        "item_id": "axes",
        "semantic_family": "axes",
        "required": true,
        "feature_refs": [
          "axis-A",
          "axis-B",
          "axis-1",
          "axis-2",
          "axis-3"
        ],
        "evidence_state": "specified",
        "source_evidence": [
          "full-floor-plan.source.json explicit acceptance definition"
        ]
      },
      {
        "item_id": "walls",
        "semantic_family": "walls",
        "required": true,
        "feature_refs": [
          "bottom-left",
          "bottom-right",
          "right-lower",
          "right-upper",
          "top-right",
          "top-left",
          "left",
          "bearing-lower",
          "bearing-upper",
          "partition"
        ],
        "evidence_state": "specified",
        "source_evidence": [
          "full-floor-plan.source.json explicit acceptance definition"
        ]
      },
      {
        "item_id": "bearing_walls",
        "semantic_family": "bearing_walls",
        "required": true,
        "feature_refs": [
          "bearing-lower",
          "bearing-upper"
        ],
        "evidence_state": "specified",
        "source_evidence": [
          "full-floor-plan.source.json explicit acceptance definition"
        ]
      },
      {
        "item_id": "partition_walls",
        "semantic_family": "partition_walls",
        "required": true,
        "feature_refs": [
          "partition"
        ],
        "evidence_state": "specified",
        "source_evidence": [
          "full-floor-plan.source.json explicit acceptance definition"
        ]
      },
      {
        "item_id": "columns",
        "semantic_family": "columns",
        "required": true,
        "feature_refs": [
          "column-1",
          "column-2",
          "column-3",
          "column-4",
          "column-5",
          "column-6"
        ],
        "evidence_state": "specified",
        "source_evidence": [
          "full-floor-plan.source.json explicit acceptance definition"
        ]
      },
      {
        "item_id": "doors",
        "semantic_family": "doors",
        "required": true,
        "feature_refs": [
          "entry",
          "internal-door",
          "bedroom-door"
        ],
        "evidence_state": "specified",
        "source_evidence": [
          "full-floor-plan.source.json explicit acceptance definition"
        ]
      },
      {
        "item_id": "windows",
        "semantic_family": "windows",
        "required": true,
        "feature_refs": [
          "living-window",
          "bedroom-window"
        ],
        "evidence_state": "specified",
        "source_evidence": [
          "full-floor-plan.source.json explicit acceptance definition"
        ]
      },
      {
        "item_id": "spaces",
        "semantic_family": "spaces",
        "required": true,
        "feature_refs": [
          "living",
          "kitchen",
          "bedroom"
        ],
        "evidence_state": "specified",
        "source_evidence": [
          "full-floor-plan.source.json explicit acceptance definition"
        ]
      },
      {
        "item_id": "fixtures",
        "semantic_family": "fixtures",
        "required": true,
        "feature_refs": [
          "sofa",
          "bed",
          "kitchen-unit"
        ],
        "evidence_state": "specified",
        "source_evidence": [
          "full-floor-plan.source.json explicit acceptance definition"
        ]
      },
      {
        "item_id": "dimensions",
        "semantic_family": "dimensions",
        "required": true,
        "feature_refs": [
          "overall-width",
          "overall-depth"
        ],
        "evidence_state": "specified",
        "source_evidence": [
          "full-floor-plan.source.json explicit acceptance definition"
        ]
      }
    ]
  },
  "payload": {
    "axes": [
      {
        "axis_id": "axis-A",
        "label": "A",
        "start": [
          0,
          0
        ],
        "end": [
          5000,
          0
        ],
        "layer": "AXES"
      },
      {
        "axis_id": "axis-B",
        "label": "B",
        "start": [
          0,
          4000
        ],
        "end": [
          5000,
          4000
        ],
        "layer": "AXES"
      },
      {
        "axis_id": "axis-1",
        "label": "1",
        "start": [
          0,
          0
        ],
        "end": [
          0,
          4000
        ],
        "layer": "AXES"
      },
      {
        "axis_id": "axis-2",
        "label": "2",
        "start": [
          2500,
          0
        ],
        "end": [
          2500,
          4000
        ],
        "layer": "AXES"
      },
      {
        "axis_id": "axis-3",
        "label": "3",
        "start": [
          5000,
          0
        ],
        "end": [
          5000,
          4000
        ],
        "layer": "AXES"
      }
    ],
    "walls": [
      {
        "wall_id": "bottom-left",
        "wall_type": "exterior",
        "start": [
          0,
          0
        ],
        "end": [